mensaje,respuesta,fecha
Necesito reservar una habitación para el siguiente viernes por dos días,"Reserva aceptada, son 500 bolivianos",20220927
"Por favor, reservar la mesa cerca del escenario para dos personas","Hemos confirmado su reserva, son 150 bolivianos",20221002
Debido a razones de fuerza mayor tengo que cancelar la reserva,"No hay problema, lo esperamos en otra oportunidad",20220930
Reservaré los asientos en el palco izquierdo,"Deberá cancelar 200 bolivianos, reserva lista",20221005
Voy a reservar,¿El asiento 9F o el 10A? ambos cuestan 310 boliviannos,20220930